<?xml version="1.0" encoding="utf-8"?>

<!DOCTYPE Info SYSTEM "matroskasegmentinfo.dtd">

<Info>
  <SegmentUID format="hex">00 01 02 03 04 05 06 07 08 09 0A 0B 0C 0D 0E 0F</SegmentUID>
  <NextSegmentUID format="hex">ff ee dd cc bb aa 99 88 77 66 55 44 33 22 11 00</NextSegmentUID>
  <PreviousSegmentUID format="hex">00 11 22 33 44 55 66 77 88 99 aa bb cc dd ee ff</PreviousSegmentUID>
  <SegmentFamily format="hex">11 00 11 11 11 22 11 33 11 44 11 55 11 66 11 77</SegmentFamily>
  <ChapterTranslate>
    <ChapterTranslateEditionUID>198273192783</ChapterTranslateEditionUID>
    <ChapterTranslateCodec>0988908</ChapterTranslateCodec>
    <ChapterTranslateID>123123</ChapterTranslateID>
  </ChapterTranslate>
  <SegmentFilename>seg FN</SegmentFilename>
  <PreviousSegmentFilename>previous segment filename</PreviousSegmentFilename>
  <NextSegmentFilename>next segment filename</NextSegmentFilename>
</Info>
